<?xml version="1.0" encoding="utf-8" ?>

<!DOCTYPE coche SYSTEM "coche.dtd">

<coche>
	<marca>Renault</marca>
	<modelo>Clio</modelo>
	<ocasion/>
	<combustible>
		<gasolina/>
	</combustible>
	<extra>elevalunas el√©ctrico</extra>
	<extra>asientos calefactables</extra>
</coche>
